OTAZKA;A;B;C;D;Spravna odpoved;Vysvetleni
Myšlení generující více výsledků řešení je;myšlení konvergentní;myšlení unovergní;myšlení divergentní;myšlení multivergní;C;
Inteligence je;vrozená vlastnost osobnosti;schopnost, kterou lze do určité míry rozvíjet po celý život;schopnost, která se po 15 roce věku již nemění;kognitivní dovednost, jejíž rozvoj nezávisí na vrozených dispozicích;B;
Pojmem coping proces se v psychologii obvykle označuje;proces nápodoby u dětí v batolecím období;proces nápodoby procesů učení v mladším školním věku;způsob zvládání stresových situací;způsob reakce na provinění žáka;C;
Pojmem školní způsobilost se označuje;nabytí klíčových kompetencí stanovených v rámcových vzdělávacích programech;intelektová způsobilost absolvovat školní docházku v běžné škole;dovršení šestého roku věku;psychická zralost a připravenost dítěte k zahájení povinné školní docházky;D;
Hierarchie – pyramida potřeb humanistického autora Abrahama Maslowa neobsahuje;potřebu sebeaktualizace;potřeby uznání;potřeby hodnotové;potřeby bezpečí;C;
Zastáncem tzv. pragmatické pedagogiky, která mj. zdůrazňovala zkušenosti žáka, kterých nabývá zejména v průběhu vlastní činnosti, byl;John Dewey;Jean Jacques Rousseau;Otakar Kádner;Platón;A;
H. Gardner zahrnuje do svého pojetí inteligence mj. také:;personální formy inteligence (intrapersonální a interpersonální nadání);sociální formy inteligence (interakční a komunikační nadání);kognitivní formy inteligence (intuitivní a racionální nadání);volní formy inteligence (návykové a snahové nadání);A;
Inteligence je:;vrozená vlastnost osobnosti;schopnost, kterou lze do určité míry rozvíjet po celý život;schopnost, která se po 18. roce věku již obvykle nemění;kognitivní dovednost, jejíž rozvoj nezávisí na vrozených dispozicích;B;
Pojem školní způsobilost znamená:;zralost a připravenost dítěte k zahájení školní docházky;dozrání laterality, preference pravé ruky;ukončení povinné školní docházky;zvládnutí přijímacího řízení do sekundárního vzdělávání;A;
Aspirační úroveň je;míra tolerance k neúspěchu;úroveň shody kognitivní struktury a reality;míra saturace kognitivní potřeby;očekávaná úroveň vlastního výkonu, výsledku;D;
Poruchy chování u žáků:;Mají multifaktoriální příčiny a intelekt žáka nemusí být porušen;Příčiny jsou genetické a intelekt bývá obvykle slabě narušený;Vznikají vždy na základě chyb v rodičovské výchově;Jsou vždy spojeny s poruchami intelektu, prognóza však bývá optimistická;A;
V české školské legislativě jsou jako povinné funkce ve školních poradenských pracovištích uvedeny:;Školní psycholog, výchovný-kariérový poradce, speciální pedagog, metodik prevence;Metodik prevence a výchovný-kariérový poradce;Metodik prevence, výchovný-kariérový poradce a školní psycholog;Jen výchovný-kariérový poradce;B;
Školní výchovný-kariérový poradce:;Může být učitelem jakého předmětu a nemá nárok na žádnou úlevu z přímé výuky;Má nárok na úlevu z přímé výuky dle legislativy a nemusí mít žádné speciální vzdělání;Má nárok na úlevu z přímé výuky dle legislativy a musí mít předepsané specializační vzdělání;Je učitelem, musí však mít vystudovaný obor psychologie nebo sociální pedagogika;C;
Výsledky učení mohou být:;Nadání, talent, návyky;Vlastnosti, znalosti, vlohy;Návyky, vědomosti, dovednosti (kompetence);Schopnosti, emoce, dovednosti;C;
Operační podmiňování;je jednoduché učení počítající se zpevněním za využití odměny;je učení se logickým myšlenkovým operacím;je učení za pomoci řešení problémů;je pouhým přizpůsobením organismu změněným podmínkám;A;
Které pojmy jsou typické pro konstruktivistické pojetí výuky?;motivace, ovlivňování, vůle, stimulace;emoce, zážitek, odměna, spolupráce;problém, trest, odměna, autoregulace;prekoncept, sdílení, aktivizace, zkušenost;D;
Autor teorie Zóny nejbližšího vývoj je:;Erikson;J. Piaget;S. Freud;L. S. Vygotskij;D;
Který pojem není typický pro dospívání?;Absolutní morálka;Prokrastinace;Konfabulace;Divergentní myšlení;C;
Diagnostiku nadání u žáků provádí:;Učitel příslušného předmětu;Výchovný poradce;Školní nebo poradenský psycholog;Třídní učitel;C;
Která následující formulace nejlépe popisuje Eriksonovu představu nejdůležitějšího vývojového úkolu v adolescenci?;hledání intimity;vývoj superega;identifikaci se sexuální rolí;hledání vlastní identity;D;
Pro kreativní řešení problémů je charakteristické myšlení;ulpívavé;konvergentní;teoretické;divergentní;D;
Mezi specifické poruchy učení nepatří;dyspinxie;dyskalkulie;dysortografie;dysfagie;D;
Pyramida potřeb hierarchizující lidské potřeby od fyziologických po sebeaktualizační je produktem bádání;Makarenka;Rogerse;Thorndikea;Maslowa;D;
Mezi aplikační oblasti psychologie jako vědní disciplíny nepatří;školní psychologie;psychologie managementu;klinická psychologie;naivní psychologie;D;
Jízda na kole je produktem učení;intelektového;mechanického;divergentního;senzomotorického;D;
Aspirace jsou v psychologii chápány jako;vývojový model;výzkumná metoda;vrozená dispozice;snaha něčeho dosáhnout;D;
Myšlení směřující k jednomu výsledku či řešení je;konvenční;konvexní;konkávní;konvergentní;D;
Schopnost chápat vlastní emoce, emoce druhých, pracovat s nimi, dovedně komunikovat a orientovat se v mezilidských vztazích označujeme jako;manipulaci;sociální fobii;komunikaci;sociální inteligenci;D;
Schopnost zvládat zátěž a stres označujeme jako;frustrační toleranci;aktivační úroveň;maladaptaci;coping;D;
Příčinou frustrace je;agresivní osobnost;inteligence jedince;stres a zátěž;nějaká překážka (vnitřní, vnější) bránící naplňování potřeb jedince;D;
Mezi druhy paměti nepatří;krátkodobá;implicitní;senzorická;kreativní;D;
Mezi dimenze výchovných stylů nepatří;emoční vztah;kontrola požadavků;řízení;motivace;D;
Pavlovovy experimenty se psy jsou příkladem jakého typu učení?;memorování;operantního podmiňování;senzomotorického učení;klasického podmiňování;D;
Pro označení, že test či jiný diagnostický prostředek skutečně ověřuje to, co jím chceme zjistit, tedy jeho platnost, označujeme pojmem;reliabilita;validita;senzibilita;efektivita;B;
Halo-efekt při poznávání osobnosti znamená;zpracování soukromých informací o člověku;generalizace prvního dojmu o jedinci;využití informací od jiných lidí;zdůraznění kladných vlastností osobnosti;B;
Pojem transfer v pedagogické psychologii znamená;využití zkušeností v podobných činnostech;převod jedné teorie do druhé;přenos základních pojmů do složitějších;vzájemné ovlivňování všech psychických funkcí;A;
Asociace znamená;spojení mezi dvěma či více vjemy, představami a jednoduchými city;jde o základní pojem geštalt-psychologie;pojem, kterým se vysvětluje chování zvířat;asociální chování;A;
Incentivou se v psychologii rozumí;vytvoření nového pojmu při učení;vnější pobídka v motivačním procesu;vnitřní pobídka v motivačním procesu;zavedení nového podnětu do procesu podmiňování;B;
Schopnosti jsou v psychologii chápány jako;adaptační mechanismy;předpoklady k úspěšnému vykonávání určité činnosti;psychofyziologické mechanismy;učením získané dispozice;B;
Divergentní myšlení;znamená myšlení, které brání tvořivosti;postupuje se různými cestami k několika odlišným řešením;vyžaduje vyšší rozvoj inteligence;je rozhodující pro vývoj u dětí předškolního věku;B;
Lateralita je;upřednostňování levé končetiny;nerovnoměrnost párových orgánů jako odraz dominance jedné z mozkových hemisfér;projev nevyhraněné dominance jedné z mozkových hemisfér;synonymum ambidextrie;B;
